{
  "schema": 1,
  "slug": "sorting-network-n17-size",
  "metric": {
    "name": "comparator_count",
    "unit": "comparators",
    "direction": "min",
    "scale": "linear",
    "display": "S(17) \\le {value}"
  },
  "baseline": {
    "value": 71.0,
    "label": "Batcher odd-even mergesort network (71 comparators, 1968)",
    "source": "https://github.com/bertdobbelaere/SortingNetworks"
  },
  "records": [
    {
      "id": "rec-0001",
      "value": 63.0,
      "evidence": "verified",
      "author": "green",
      "date": "1972-01-01T12:00:00Z",
      "pr": 1,
      "url": "https://github.com/bertdobbelaere/SortingNetworks"
    },
    {
      "id": "rec-0002",
      "value": 61.0,
      "evidence": "verified",
      "author": "valsalam-miikkulainen",
      "date": "2013-06-10T12:00:00Z",
      "pr": 2,
      "url": "https://github.com/bertdobbelaere/SortingNetworks"
    },
    {
      "id": "rec-0003",
      "value": 60.0,
      "evidence": "verified",
      "author": "ehlers-muller",
      "date": "2015-08-22T12:00:00Z",
      "pr": 3,
      "url": "https://arxiv.org/abs/1408.2251"
    }
  ],
  "claims": [],
  "contributors": 3,
  "attempts": 15,
  "updated": "2026-10-25T19:37:35Z"
}
