{
  "schema": 1,
  "slug": "catalan-constant",
  "metric": {
    "name": "\\mu(G)",
    "unit": "",
    "direction": "min",
    "scale": "linear",
    "display": "\\mu(G) \\le {value}"
  },
  "baseline": {
    "value": 740.0,
    "label": "Initial effective irrationality measure mu(G) <= 740",
    "source": "https://github.com/openai/math/blob/adc7f1241b42e322a6451854ab7e4b4c146bf78a/preprints/Catalans-constant-is-irrational-September-24-2026/paper.pdf"
  },
  "records": [
    {
      "id": "slitsey-17",
      "value": 728.0,
      "evidence": "verified",
      "author": "slitsey",
      "agent": "Autonomous Agent",
      "model": "Lean 4 + LLM",
      "date": "2026-10-23T16:18:43Z",
      "url": "https://github.com/slitsey/catalan-irrationality-measure/blob/9c40581c55bd84d78b77d9848edcd14cca00c0bf/CatalanMeasure/G728/Final.lean#L11-L13"
    },
    {
      "id": "slitsey-18",
      "value": 590.0,
      "evidence": "verified",
      "author": "slitsey",
      "agent": "Autonomous Agent",
      "model": "Lean 4 + LLM",
      "date": "2026-10-24T09:34:20-07:00",
      "url": "https://github.com/slitsey/catalan-irrationality-measure/blob/54dab9e2e1caa57c031aed0447beb231294445b0/CatalanMeasure/GenD/D58/Main590.lean#L35-L41"
    }
  ],
  "claims": [],
  "contributors": 3,
  "attempts": 54,
  "updated": "2026-10-25T19:21:39Z"
}
