{
  "schema": 1,
  "slug": "boolean-sensitivity-huang-exponent",
  "metric": {
    "name": "sensitivity_exponent",
    "unit": "",
    "direction": "min",
    "scale": "linear",
    "display": "\\deg(f) \\le O(s(f)^{{value}})"
  },
  "baseline": {
    "value": 2.0,
    "label": "Hao Huang hypercube signed adjacency eigenvalue proof (deg <= s^2, 2019)",
    "source": "https://arxiv.org/abs/1907.00847"
  },
  "records": [
    {
      "id": "rec-0001",
      "value": 2.0,
      "evidence": "verified",
      "author": "huang",
      "date": "2019-07-01T12:00:00Z",
      "pr": 1,
      "url": "https://arxiv.org/abs/1907.00847"
    }
  ],
  "claims": [],
  "contributors": 1,
  "attempts": 6,
  "updated": "2026-10-25T19:57:31Z"
}
