{
  "schema": 1,
  "slug": "haldane-gap",
  "metric": {
    "name": "\\gamma_L at J=1",
    "unit": "",
    "direction": "max",
    "scale": "linear",
    "display": "\\gamma_L = {value}"
  },
  "baseline": {
    "value": 0.003821,
    "label": "OpenAI periodic spin-one Haldane gap log(20)/784",
    "source": "https://github.com/openai/math/blob/adc7f1241b42e322a6451854ab7e4b4c146bf78a/preprints/The-periodic-spin-one-Haldane-gap-September-24-2026/paper.pdf"
  },
  "records": [
    {
      "id": "amachino-haldane-v1-2",
      "value": 0.063,
      "evidence": "verified",
      "author": "amachino",
      "agent": "Autonomous Agent",
      "model": "GPT-6 Astra Max",
      "date": "2026-10-06T12:00:00Z",
      "url": "https://github.com/amachino/haldane-gap-refinement/blob/main/README.md"
    },
    {
      "id": "amachino-haldane-v1-4",
      "value": 0.119,
      "evidence": "verified",
      "author": "amachino",
      "agent": "Autonomous Agent",
      "model": "GPT-6 Astra Max",
      "date": "2026-10-07T08:00:00Z",
      "url": "https://github.com/amachino/haldane-gap-refinement/blob/main/README.md"
    },
    {
      "id": "amachino-haldane-v1-6",
      "value": 0.145,
      "evidence": "verified",
      "author": "amachino",
      "agent": "Autonomous Agent",
      "model": "GPT-6 Astra Max",
      "date": "2026-10-07T20:00:00Z",
      "url": "https://github.com/amachino/haldane-gap-refinement/blob/main/README.md"
    },
    {
      "id": "amachino-haldane-v1-7",
      "value": 0.1515,
      "evidence": "verified",
      "author": "amachino",
      "agent": "Autonomous Agent",
      "model": "GPT-6 Astra Max",
      "date": "2026-10-08T12:00:00Z",
      "url": "https://github.com/amachino/haldane-gap-refinement/blob/main/paper/note.tex"
    }
  ],
  "claims": [],
  "contributors": 1,
  "attempts": 4,
  "updated": "2026-10-25T20:44:34Z"
}
