{
  "schema": 1,
  "slug": "busy-beaver-bb5-deciders",
  "metric": {
    "name": "undecided_machines",
    "unit": "machines",
    "direction": "min",
    "scale": "linear",
    "display": "{value}\\text{ holdouts}"
  },
  "baseline": {
    "value": 88664064.0,
    "label": "bbchallenge starter seed corpus (88,664,064 machines)",
    "source": "https://bbchallenge.org/"
  },
  "records": [
    {
      "id": "rec-0001",
      "value": 30.0,
      "evidence": "verified",
      "author": "tcosmo",
      "date": "2024-05-10T12:00:00Z",
      "pr": 42,
      "url": "https://bbchallenge.org/"
    },
    {
      "id": "rec-0002",
      "value": 0.0,
      "evidence": "verified",
      "author": "mxdys",
      "date": "2024-07-02T12:00:00Z",
      "pr": 88,
      "url": "https://bbchallenge.org/"
    }
  ],
  "claims": [],
  "contributors": 2,
  "attempts": 10,
  "updated": "2026-10-25T19:57:31Z"
}
